{
  "schemaVersion": "0.1.0",
  "datasetStatus": "research-prototype",
  "updated": "2026-10-06",
  "projectSlug": "fireworks-simulator",
  "scope": "Professional aerial-shell visual simulation research. No operational pyrotechnic construction or firing data.",
  "units": {
    "distance": "m",
    "calibre": "mm",
    "speed": "m/s",
    "time": "s",
    "angle": "deg",
    "colourLifetime": "normalized 0-1"
  },
  "evidenceClasses": {
    "measured": "Direct scientific measurement or fitted observation.",
    "regulatory-approximation": "Approximation stated by an official government/regulatory technical reference.",
    "manufacturer-declared": "Product value stated by a manufacturer or supplier.",
    "professional-simulator-convention": "Field or semantic convention used by professional fireworks simulation/show software.",
    "derived": "Calculated directly from cited source values.",
    "rendering-hypothesis": "Provisional browser-visual tuning. Must not be presented as measured reality."
  },
  "sources": [
    {
      "id": "nrcan-display-manual-2010",
      "title": "Display Fireworks Manual 2010",
      "publisher": "Natural Resources Canada",
      "url": "https://natural-resources.canada.ca/minerals-mining/explosives-fireworks-ammunition/explosives/display-fireworks-manual-2010",
      "retrieved": "2026-10-06",
      "role": "Official scale approximation and aerial-shell terminology"
    },
    {
      "id": "ams-fireworks-radar-2020",
      "title": "Fireworks on Weather Radar and Camera",
      "publisher": "Bulletin of the American Meteorological Society",
      "url": "https://doi.org/10.1175/BAMS-D-18-0248.1",
      "retrieved": "2026-10-06",
      "role": "Empirical burst dimensions, lifetime and star-motion calibration"
    },
    {
      "id": "apa-display-glossary",
      "title": "Display Fireworks Glossary",
      "publisher": "American Pyrotechnics Association",
      "url": "https://www.americanpyro.com/display-fireworks-glossary",
      "retrieved": "2026-10-06",
      "role": "Industry terminology cross-check"
    },
    {
      "id": "finale-vdl-glossary",
      "title": "Glossary of VDL Effect Terms",
      "publisher": "Finale 3D",
      "url": "https://finale3d.com/documentation/vdl-effect-glossary/",
      "retrieved": "2026-10-06",
      "role": "Professional simulator effect semantics"
    },
    {
      "id": "finale-effect-adjustments",
      "title": "VDL effect adjustment terms",
      "publisher": "Finale 3D",
      "url": "https://finale3d.com/documentation/vdl-effect-adjustment-terms-big-bright-etc/",
      "retrieved": "2026-10-06",
      "role": "Professional simulator parameter vocabulary"
    },
    {
      "id": "finale-colours",
      "title": "VDL colors",
      "publisher": "Finale 3D",
      "url": "https://finale3d.com/documentation/vdl-colors/",
      "retrieved": "2026-10-06",
      "role": "Professional colour/trail semantics"
    },
    {
      "id": "finale-effect-fields",
      "title": "Effects window columns and supplier import fields",
      "publisher": "Finale 3D",
      "url": "https://finale3d.com/documentation/effects-table-columns/",
      "retrieved": "2026-10-06",
      "role": "Professional simulator field separation: size, height, duration and description"
    },
    {
      "id": "finale-prefire",
      "title": "Prefire",
      "publisher": "Finale 3D",
      "url": "https://finale3d.com/documentation/prefire/",
      "retrieved": "2026-10-06",
      "role": "Lift/prefire timing convention"
    },
    {
      "id": "jinping-75mm-shells",
      "title": "3 inch series display shell",
      "publisher": "JinPing Fireworks",
      "url": "https://www.pyrotechnic-manufacture.com/3-series-display-shell-products/",
      "retrieved": "2026-10-06",
      "role": "Manufacturer-declared 75 mm effect-height example"
    },
    {
      "id": "jinping-125mm-shells",
      "title": "5 inch series display shell",
      "publisher": "JinPing Fireworks",
      "url": "https://www.pyrotechnic-manufacture.com/china-wholesale-cold-flame-indoor-fireworks-factories-5-series-display-shell-jinping-fireworks-products/",
      "retrieved": "2026-10-06",
      "role": "Manufacturer-declared 125 mm effect-height example"
    },
    {
      "id": "jinping-150mm-shells",
      "title": "6 inch series display shell",
      "publisher": "JinPing Fireworks",
      "url": "https://www.pyrotechnic-manufacture.com/china-wholesale-shells-fireworks-factories-6-series-display-shell-jinping-fireworks-products/",
      "retrieved": "2026-10-06",
      "role": "Manufacturer-declared 150 mm effect-height example"
    }
  ],
  "scaleReference": {
    "burstHeightPer25mmM": 33,
    "maxSpreadDiameterPer25mmM": 27,
    "sourceRefs": [
      "nrcan-display-manual-2010"
    ],
    "shells": [
      {
        "calibreMm": 75,
        "nominalInches": 3,
        "approxBurstHeightM": 99.0,
        "approxMaxSpreadDiameterM": 81.0,
        "evidence": "regulatory-approximation",
        "sourceRefs": [
          "nrcan-display-manual-2010"
        ]
      },
      {
        "calibreMm": 100,
        "nominalInches": 4,
        "approxBurstHeightM": 132.0,
        "approxMaxSpreadDiameterM": 108.0,
        "evidence": "regulatory-approximation",
        "sourceRefs": [
          "nrcan-display-manual-2010"
        ]
      },
      {
        "calibreMm": 125,
        "nominalInches": 5,
        "approxBurstHeightM": 165.0,
        "approxMaxSpreadDiameterM": 135.0,
        "evidence": "regulatory-approximation",
        "sourceRefs": [
          "nrcan-display-manual-2010"
        ]
      },
      {
        "calibreMm": 150,
        "nominalInches": 6,
        "approxBurstHeightM": 198.0,
        "approxMaxSpreadDiameterM": 162.0,
        "evidence": "regulatory-approximation",
        "sourceRefs": [
          "nrcan-display-manual-2010"
        ]
      },
      {
        "calibreMm": 200,
        "nominalInches": 8,
        "approxBurstHeightM": 264.0,
        "approxMaxSpreadDiameterM": 216.0,
        "evidence": "regulatory-approximation",
        "sourceRefs": [
          "nrcan-display-manual-2010"
        ]
      },
      {
        "calibreMm": 250,
        "nominalInches": 10,
        "approxBurstHeightM": 330.0,
        "approxMaxSpreadDiameterM": 270.0,
        "evidence": "regulatory-approximation",
        "sourceRefs": [
          "nrcan-display-manual-2010"
        ]
      },
      {
        "calibreMm": 300,
        "nominalInches": 12,
        "approxBurstHeightM": 396.0,
        "approxMaxSpreadDiameterM": 324.0,
        "evidence": "regulatory-approximation",
        "sourceRefs": [
          "nrcan-display-manual-2010"
        ]
      }
    ],
    "manufacturerExamples": [
      {
        "calibreMm": 75,
        "effectHeightRangeM": [
          100,
          110
        ],
        "evidence": "manufacturer-declared",
        "sourceRefs": [
          "jinping-75mm-shells"
        ],
        "note": "Example normal display-shell catalogue range; not universal."
      },
      {
        "calibreMm": 125,
        "effectHeightRangeM": [
          130,
          150
        ],
        "evidence": "manufacturer-declared",
        "sourceRefs": [
          "jinping-125mm-shells"
        ],
        "note": "Example normal display-shell catalogue range; not universal."
      },
      {
        "calibreMm": 150,
        "effectHeightRangeM": [
          160,
          170
        ],
        "evidence": "manufacturer-declared",
        "sourceRefs": [
          "jinping-150mm-shells"
        ],
        "note": "Example normal display-shell catalogue range; not universal."
      }
    ]
  },
  "empiricalCalibrations": [
    {
      "id": "ams-peony-2017",
      "label": "Measured Peony example, Norman Oklahoma 2017 display",
      "familyId": "peony",
      "burstHeightM": 190,
      "maxDiameterM": 100,
      "visibleStarCount": 121,
      "visibleDurationS": 1.0,
      "initialExpansionMps": 170,
      "velocityModel": "v(t)=170/(1+0.04*170*t)",
      "radialDisplacementModel": "r(t)=ln(1+0.04*170*t)/0.04",
      "evidence": "measured",
      "sourceRefs": [
        "ams-fireworks-radar-2020"
      ],
      "limitations": "Single analysed Peony-like burst; not a universal shell profile."
    }
  ],
  "observedRanges": {
    "typicalBurstHeightM": [
      100,
      200
    ],
    "highestObservedBurstM": 270,
    "mostBurstDiameterM": [
      100,
      150
    ],
    "visibleDurationS": [
      1,
      6
    ],
    "peonyTerminalVelocityMps": [
      14,
      16
    ],
    "willowObservedTerminalVelocityMps": 22,
    "evidence": "measured",
    "sourceRefs": [
      "ams-fireworks-radar-2020"
    ],
    "limitations": "Ranges come from one recorded display and are sanity bounds, not universal product specifications."
  },
  "rendererPalette": [
    {
      "id": "red",
      "label": "Red",
      "renderHex": "#ff334d",
      "trailOriented": false,
      "evidence": "rendering-hypothesis"
    },
    {
      "id": "ruby",
      "label": "Ruby",
      "renderHex": "#ff356f",
      "trailOriented": false,
      "evidence": "rendering-hypothesis"
    },
    {
      "id": "orange",
      "label": "Orange",
      "renderHex": "#ff8a2a",
      "trailOriented": false,
      "evidence": "rendering-hypothesis"
    },
    {
      "id": "yellow",
      "label": "Yellow",
      "renderHex": "#ffe055",
      "trailOriented": false,
      "evidence": "rendering-hypothesis"
    },
    {
      "id": "green",
      "label": "Green",
      "renderHex": "#54e65c",
      "trailOriented": false,
      "evidence": "rendering-hypothesis"
    },
    {
      "id": "lime",
      "label": "Lime",
      "renderHex": "#a8ed56",
      "trailOriented": false,
      "evidence": "rendering-hypothesis"
    },
    {
      "id": "blue",
      "label": "Blue",
      "renderHex": "#5a78ff",
      "trailOriented": false,
      "evidence": "rendering-hypothesis"
    },
    {
      "id": "sea-blue",